{
  "form_info": {
    "form_number": "ACORD 160",
    "form_edition": null,
    "form_title": "BUSINESSOWNERS APPLICATION"
  },
  "header": {
    "insured_name": "Keystone Commercial Builders, Inc.",
    "insured_address": "300 Liberty Avenue, Suite 1200",
    "insured_city": "Pittsburgh",
    "insured_state": "PA",
    "insured_zip": "15222",
    "carrier_name": "Hallmark Insurance Group",
    "policy_number": "BOP-803-2025-5583",
    "effective_date": "2025-08-01",
    "expiration_date": "2026-08-01",
    "producer_name": "Steel City Insurance Group",
    "producer_code": null
  },
  "applicant_info": {
    "fein": "25-7194583",
    "sic_code": "1521",
    "naics_code": "236220",
    "years_in_business": 42,
    "nature_of_business": "Construction \u2014 primarily for commercial and institutional construction \u2014 healthcare facilities, educational buildings, and corporate offices throughout Western Pennsylvania",
    "entity_type": "Corporation"
  },
  "locations": [
    {
      "location_number": "1",
      "address": "300 Liberty Avenue, Suite 1200",
      "city": "Pittsburgh",
      "state": "PA",
      "zip": "15222",
      "construction": "Fire Resistive",
      "occupancy": "Office",
      "year_built": 2008,
      "stories": 1,
      "square_feet": 18000,
      "sprinklered": true,
      "roof_type": "EPDM",
      "sprinkler_type": null,
      "fire_alarm_type": null,
      "building_value": 10400000,
      "contents_value": 18455000,
      "bi_value": 10530000,
      "tiv": 39405000
    },
    {
      "location_number": "2",
      "address": "4500 Butler Street",
      "city": "Pittsburgh",
      "state": "PA",
      "zip": "15201",
      "construction": "Non-Combustible",
      "occupancy": "Warehouse",
      "year_built": 1995,
      "stories": 1,
      "square_feet": 65000,
      "sprinklered": true,
      "roof_type": "EPDM",
      "sprinkler_type": null,
      "fire_alarm_type": null,
      "building_value": 5200000,
      "contents_value": 6850000,
      "bi_value": 5500000,
      "tiv": 17550000
    },
    {
      "location_number": "3",
      "address": "8250 Butler Street",
      "city": "Pittsburgh",
      "state": "PA",
      "zip": "15201",
      "construction": "Masonry Non-Combustible",
      "occupancy": "Manufacturing",
      "year_built": 1988,
      "stories": 1,
      "square_feet": 32000,
      "sprinklered": true,
      "roof_type": "TPO",
      "sprinkler_type": null,
      "fire_alarm_type": null,
      "building_value": 2240000,
      "contents_value": 3960000,
      "bi_value": 1800000,
      "tiv": 8000000
    },
    {
      "location_number": "4",
      "address": "3000 Village Run Road",
      "city": "Wexford",
      "state": "PA",
      "zip": "15090",
      "construction": "Masonry Non-Combustible",
      "occupancy": "Office",
      "year_built": 2010,
      "stories": 2,
      "square_feet": 8500,
      "sprinklered": true,
      "roof_type": "Shingle",
      "sprinkler_type": null,
      "fire_alarm_type": null,
      "building_value": 1700000,
      "contents_value": 425000,
      "bi_value": 850000,
      "tiv": 2975000
    },
    {
      "location_number": "5",
      "address": "400 Duffy Road",
      "city": "Cranberry Township",
      "state": "PA",
      "zip": "16066",
      "construction": "Non-Combustible",
      "occupancy": "Warehouse",
      "year_built": 2005,
      "stories": 1,
      "square_feet": 28000,
      "sprinklered": false,
      "roof_type": "Concrete",
      "sprinkler_type": null,
      "fire_alarm_type": null,
      "building_value": 1660000,
      "contents_value": 4400000,
      "bi_value": 1220000,
      "tiv": 7280000
    }
  ],
  "additional_coverages": [
    {
      "coverage_type": "Employee Dishonesty",
      "limit": 50000,
      "premium": null
    },
    {
      "coverage_type": "Personal Effects & Property of Others",
      "limit": 10000,
      "premium": null
    },
    {
      "coverage_type": "Forgery or Alteration",
      "limit": 25000,
      "premium": null
    },
    {
      "coverage_type": "Cyber Liability",
      "limit": 1000000,
      "premium": null
    },
    {
      "coverage_type": "Accounts Receivable",
      "limit": 25000,
      "premium": null
    },
    {
      "coverage_type": "Utility Services \u2014 Time Element",
      "limit": 25000,
      "premium": null
    },
    {
      "coverage_type": "Computer Fraud",
      "limit": 25000,
      "premium": null
    },
    {
      "coverage_type": "Ordinance or Law \u2014 Coverage C",
      "limit": 250000,
      "premium": null
    },
    {
      "coverage_type": "Stop Gap / Employers Liability",
      "limit": 100000,
      "premium": null
    },
    {
      "coverage_type": "Debris Removal \u2014 Additional",
      "limit": 25000,
      "premium": null
    },
    {
      "coverage_type": "Primary & Non-Contributory",
      "limit": null,
      "premium": null
    },
    {
      "coverage_type": "Employment Practices Liability",
      "limit": 100000,
      "premium": null
    },
    {
      "coverage_type": "Tenant Legal Liability",
      "limit": 100000,
      "premium": null
    },
    {
      "coverage_type": "Extra Expense",
      "limit": 50000,
      "premium": null
    },
    {
      "coverage_type": "Pollutant Cleanup and Removal",
      "limit": 25000,
      "premium": null
    }
  ],
  "interests": [
    {
      "name": "M&T Bank",
      "loan_number": "L-362713106",
      "interest_type": "ISAOA/ATIMA"
    },
    {
      "name": "Fifth Third Bank",
      "loan_number": "L-167825479",
      "interest_type": "ISAOA/ATIMA"
    },
    {
      "name": "Regions Bank",
      "loan_number": "L-479785341",
      "interest_type": "First Mortgagee"
    }
  ],
  "property_premium": 76073.77,
  "property_deductible": 25000,
  "total_tiv": 39405000,
  "checkboxes": [
    {
      "field": "Does the applicant store flammable liquids on premises?",
      "value": "Yes"
    },
    {
      "field": "Are there any swimming pools or hot tubs on premises?",
      "value": "No"
    },
    {
      "field": "Is the applicant the building owner or lessee?",
      "value": "Yes"
    },
    {
      "field": "Is the applicant responsible for building maintenance?",
      "value": "Yes"
    },
    {
      "field": "Are there any recent renovations or updates?",
      "value": "Yes"
    },
    {
      "field": "Is the applicant the sole occupant of the building?",
      "value": "Yes"
    },
    {
      "field": "Does the building have a backup generator?",
      "value": "No"
    },
    {
      "field": "Does the applicant have a burglar alarm system?",
      "value": "No"
    },
    {
      "field": "Does the applicant have any off-premises property exposures?",
      "value": "Yes"
    },
    {
      "field": "Are there any cooking operations on premises?",
      "value": "No"
    },
    {
      "field": "Are there any exterior signs or awnings?",
      "value": "No"
    },
    {
      "field": "Does the applicant sell or distribute products manufactured by others?",
      "value": "No"
    },
    {
      "field": "Is the building 100% sprinklered?",
      "value": "Yes"
    },
    {
      "field": "Are there any underground storage tanks on premises?",
      "value": "No"
    },
    {
      "field": "Are there any alterations or construction in progress?",
      "value": "No"
    },
    {
      "field": "Are commercial cooking operations (deep fat fryers, char broilers, woks, or commercial kitchen hoods) used on premises?",
      "value": "No"
    }
  ],
  "remarks": null
}