{
  "additional_coverages": [
    {
      "coverage_type": "Building",
      "limit": 10900000,
      "premium": null
    },
    {
      "coverage_type": "Business Personal Property",
      "limit": 18455000,
      "premium": null
    },
    {
      "coverage_type": "Business Income with Extra Expense",
      "limit": 10130000,
      "premium": null
    },
    {
      "coverage_type": "Each Occurrence",
      "limit": 2000000,
      "premium": null
    },
    {
      "coverage_type": "General Aggregate",
      "limit": 4000000,
      "premium": null
    },
    {
      "coverage_type": "Products/Completed Operations",
      "limit": 4000000,
      "premium": null
    },
    {
      "coverage_type": "Personal & Advertising Injury",
      "limit": 2000000,
      "premium": null
    },
    {
      "coverage_type": "Damage to Premises Rented to You",
      "limit": 500000,
      "premium": null
    },
    {
      "coverage_type": "Medical Expense (Any One Person)",
      "limit": 15000,
      "premium": null
    },
    {
      "coverage_type": "Employee Dishonesty",
      "limit": 25000,
      "premium": null
    },
    {
      "coverage_type": "Personal Effects & Property of Others",
      "limit": 10000,
      "premium": null
    },
    {
      "coverage_type": "Forgery or Alterations",
      "limit": 25000,
      "premium": null
    },
    {
      "coverage_type": "Cyber Liability",
      "limit": 100000,
      "premium": null
    },
    {
      "coverage_type": "Accounts Receivable",
      "limit": 25000,
      "premium": null
    },
    {
      "coverage_type": "Utility Services \u2014 Time Element",
      "limit": 25000,
      "premium": null
    },
    {
      "coverage_type": "Computer Fraud",
      "limit": 25000,
      "premium": null
    },
    {
      "coverage_type": "Ordinance or Law \u2014 Coverage C",
      "limit": 250000,
      "premium": null
    },
    {
      "coverage_type": "Stop Gap / Employers Liability",
      "limit": 500000,
      "premium": null
    },
    {
      "coverage_type": "Debris Removal \u2014 Additional",
      "limit": 25000,
      "premium": null
    },
    {
      "coverage_type": "Primary & Non-Contributory",
      "limit": null,
      "premium": null
    },
    {
      "coverage_type": "Employment Practices Liability",
      "limit": 100000,
      "premium": null
    },
    {
      "coverage_type": "Tenant Legal Liability",
      "limit": 100000,
      "premium": null
    },
    {
      "coverage_type": "Extra Expense",
      "limit": 50000,
      "premium": null
    },
    {
      "coverage_type": "Pollutant Cleanup and Removal",
      "limit": 25000,
      "premium": null
    }
  ],
  "applicant_info": {
    "entity_type": "Corporation",
    "fein": "25-7745658",
    "naics_code": "236220",
    "nature_of_business": "Commercial contractors specializing in mid-sized construction \u2014 healthcare facilities, educational buildings, and commercial offices throughout Western Pennsylvania.",
    "sic_code": "1521",
    "years_in_business": 42
  },
  "checkboxes": [
    {
      "field": "Does the applicant store flammable liquids on premises?",
      "value": "Yes"
    },
    {
      "field": "Are there any swimming pools or hot tubs on premises?",
      "value": "No"
    },
    {
      "field": "Is the applicant the building owner or tenant?",
      "value": "Yes"
    },
    {
      "field": "Is the applicant responsible for building maintenance?",
      "value": "Yes"
    },
    {
      "field": "Are there any tenant improvements or betterments?",
      "value": "Yes"
    },
    {
      "field": "Is the applicant the sole occupant of the building?",
      "value": "Yes"
    },
    {
      "field": "Does the building have a backup generator?",
      "value": "No"
    },
    {
      "field": "Does the applicant have a burglar alarm system?",
      "value": "No"
    },
    {
      "field": "Does the applicant have any off-premises property exposures?",
      "value": "Yes"
    },
    {
      "field": "Are there any cooking operations on premises?",
      "value": "No"
    },
    {
      "field": "Are there any exterior signs or awnings?",
      "value": "No"
    },
    {
      "field": "Does the applicant sell or distribute products manufactured by others?",
      "value": "No"
    },
    {
      "field": "Is the building 100% sprinklered?",
      "value": "Yes"
    },
    {
      "field": "Are there any underground storage tanks on premises?",
      "value": "No"
    },
    {
      "field": "Are there any alterations or construction in progress?",
      "value": "No"
    },
    {
      "field": "Are commercial cooking operations used on premises?",
      "value": "No"
    }
  ],
  "form_info": {
    "form_edition": "2020/09",
    "form_number": "ACORD 160",
    "form_title": "Businessowners Application"
  },
  "header": {
    "carrier_name": "Hallmark Insurance Group",
    "effective_date": "2025-06-01",
    "expiration_date": "2026-06-01",
    "insured_address": "300 Liberty Avenue, Suite 1200",
    "insured_city": "Pittsburgh",
    "insured_name": "Keystone Commercial Builders, Inc.",
    "insured_state": "PA",
    "insured_zip": "15222",
    "policy_number": "BP-903-855-5583",
    "producer_code": null,
    "producer_name": "Steel City Insurance Group"
  },
  "interests": [
    {
      "interest_type": "ISAOA/ATIMA",
      "loan_number": "L-3267131966",
      "name": "MBT Bank"
    },
    {
      "interest_type": "ISAOA/ATIMA",
      "loan_number": "L-167705479",
      "name": "Fifth Third Bank"
    },
    {
      "interest_type": "First Mortgagee",
      "loan_number": "L-432785954",
      "name": "Riverview Bank"
    }
  ],
  "locations": [
    {
      "address": "300 Liberty Avenue, Suite 1200",
      "bi_value": 2340000,
      "building_value": 0,
      "city": "Pittsburgh",
      "construction": "Fire Resistive",
      "contents_value": 1260000,
      "fire_alarm_type": null,
      "location_number": "LOC-001",
      "occupancy": "Office",
      "roof_type": "EPDM",
      "sprinkler_type": null,
      "sprinklered": true,
      "square_feet": 18000,
      "state": "PA",
      "stories": 1,
      "tiv": 3600000,
      "year_built": 2023,
      "zip": "15222"
    },
    {
      "address": "4500 Butler Street",
      "bi_value": 3900000,
      "building_value": 5200000,
      "city": "Pittsburgh",
      "construction": "Non-Combustible",
      "contents_value": 8450000,
      "fire_alarm_type": null,
      "location_number": "LOC-002",
      "occupancy": "Warehouse",
      "roof_type": "EPDM",
      "sprinkler_type": null,
      "sprinklered": true,
      "square_feet": 65000,
      "state": "PA",
      "stories": 1,
      "tiv": 17550000,
      "year_built": 1995,
      "zip": "15201"
    },
    {
      "address": "2820 Butler Street",
      "bi_value": 1920000,
      "building_value": 2240000,
      "city": "Pittsburgh",
      "construction": "Masonry Non-Combustible",
      "contents_value": 3840000,
      "fire_alarm_type": null,
      "location_number": "LOC-003",
      "occupancy": "Manufacturing",
      "roof_type": "TPO",
      "sprinkler_type": null,
      "sprinklered": true,
      "square_feet": 32000,
      "state": "PA",
      "stories": 1,
      "tiv": 8000000,
      "year_built": 1988,
      "zip": "15201"
    },
    {
      "address": "5000 Village Run Road",
      "bi_value": 850000,
      "building_value": 1780000,
      "city": "Wexford",
      "construction": "Masonry Non-Combustible",
      "contents_value": 425000,
      "fire_alarm_type": null,
      "location_number": "LOC-004",
      "occupancy": "Office",
      "roof_type": "Shingle",
      "sprinkler_type": null,
      "sprinklered": true,
      "square_feet": 8500,
      "state": "PA",
      "stories": 2,
      "tiv": 3055000,
      "year_built": 2010,
      "zip": "15090"
    },
    {
      "address": "800 Dutch Road",
      "bi_value": 1120000,
      "building_value": 1680000,
      "city": "Cranberry Township",
      "construction": "Non-Combustible",
      "contents_value": 4480000,
      "fire_alarm_type": null,
      "location_number": "LOC-005",
      "occupancy": "Warehouse",
      "roof_type": "Concrete",
      "sprinkler_type": null,
      "sprinklered": false,
      "square_feet": 28000,
      "state": "PA",
      "stories": 1,
      "tiv": 7280000,
      "year_built": 2005,
      "zip": "16066"
    }
  ],
  "property_deductible": 25000,
  "property_premium": 76073.77,
  "remarks": null,
  "total_tiv": 39485000
}