{
  "form_info": {
    "form_number": "ACORD 160",
    "form_edition": "2016/03",
    "form_title": "BUSINESSOWNERS APPLICATION"
  },
  "header": {
    "insured_name": "Buckeye Industrial Properties, LLC",
    "insured_address": "250 Civic Center Drive, Suite 600",
    "insured_city": "Columbus",
    "insured_state": "OH",
    "insured_zip": "43215",
    "carrier_name": "Maine Employers Mutual",
    "policy_number": "CP-BIP-2025-4420",
    "effective_date": "2025-09-01",
    "expiration_date": "2026-09-01",
    "producer_name": "Midwest Property & Casualty Group",
    "producer_code": "AG-509227"
  },
  "applicant_info": {
    "fein": "31-5847293",
    "sic_code": "6512",
    "naics_code": "531130",
    "years_in_business": 31,
    "nature_of_business": "Industrial real estate investment and management \u2014 warehouse, distribution, and light manufacturing facilities throughout Ohio",
    "entity_type": "LLC"
  },
  "locations": [
    {
      "location_number": "1",
      "address": "6500 Alum Creek Drive",
      "city": "Columbus",
      "state": "OH",
      "zip": "43217",
      "construction": "Non-Combustible",
      "occupancy": "Warehouse",
      "year_built": 2014,
      "stories": 1,
      "square_feet": 425000,
      "sprinklered": true,
      "roof_type": "Shingle",
      "sprinkler_type": null,
      "fire_alarm_type": null,
      "building_value": 34000000,
      "contents_value": 8500000,
      "bi_value": 12750000,
      "tiv": 55250000
    },
    {
      "location_number": "2",
      "address": "6600 Alum Creek Drive",
      "city": "Columbus",
      "state": "OH",
      "zip": "43217",
      "construction": "Non-Combustible",
      "occupancy": "Warehouse",
      "year_built": 2016,
      "stories": 1,
      "square_feet": 380000,
      "sprinklered": true,
      "roof_type": "TPO",
      "sprinkler_type": null,
      "fire_alarm_type": null,
      "building_value": 30400000,
      "contents_value": 7600000,
      "bi_value": 11400000,
      "tiv": 49400000
    },
    {
      "location_number": "3",
      "address": "4800 Tiedeman Road",
      "city": "Brooklyn",
      "state": "OH",
      "zip": "44144",
      "construction": "Non-Combustible",
      "occupancy": "Warehouse",
      "year_built": 2008,
      "stories": 1,
      "square_feet": 295000,
      "sprinklered": true,
      "roof_type": "EPDM",
      "sprinkler_type": null,
      "fire_alarm_type": null,
      "building_value": 20650000,
      "contents_value": 5900000,
      "bi_value": 8850000,
      "tiv": 35400000
    },
    {
      "location_number": "4",
      "address": "2100 Kuntz Road",
      "city": "Dayton",
      "state": "OH",
      "zip": "45404",
      "construction": "Joisted Masonry",
      "occupancy": "Manufacturing",
      "year_built": 1992,
      "stories": 1,
      "square_feet": 185000,
      "sprinklered": true,
      "roof_type": "Metal",
      "sprinkler_type": null,
      "fire_alarm_type": null,
      "building_value": 11100000,
      "contents_value": 5550000,
      "bi_value": 6660000,
      "tiv": 23310000
    },
    {
      "location_number": "5",
      "address": "11600 Mosteller Road",
      "city": "Cincinnati",
      "state": "OH",
      "zip": "45241",
      "construction": "Non-Combustible",
      "occupancy": "Warehouse",
      "year_built": 2019,
      "stories": 1,
      "square_feet": 220000,
      "sprinklered": true,
      "roof_type": "Built-Up",
      "sprinkler_type": null,
      "fire_alarm_type": null,
      "building_value": 19800000,
      "contents_value": 4400000,
      "bi_value": 7920000,
      "tiv": 32120000
    },
    {
      "location_number": "6",
      "address": "3200 Hill Avenue",
      "city": "Toledo",
      "state": "OH",
      "zip": "43607",
      "construction": "Masonry Non-Combustible",
      "occupancy": "Warehouse",
      "year_built": 2004,
      "stories": 1,
      "square_feet": 165000,
      "sprinklered": true,
      "roof_type": "Metal",
      "sprinkler_type": null,
      "fire_alarm_type": null,
      "building_value": 11550000,
      "contents_value": 3300000,
      "bi_value": 4950000,
      "tiv": 19800000
    },
    {
      "location_number": "7",
      "address": "3250 Hill Avenue",
      "city": "Toledo",
      "state": "OH",
      "zip": "43607",
      "construction": "Masonry Non-Combustible",
      "occupancy": "Manufacturing",
      "year_built": 1998,
      "stories": 1,
      "square_feet": 142000,
      "sprinklered": false,
      "roof_type": "EPDM",
      "sprinkler_type": null,
      "fire_alarm_type": null,
      "building_value": 8520000,
      "contents_value": 4260000,
      "bi_value": 4260000,
      "tiv": 17040000
    },
    {
      "location_number": "8",
      "address": "1475 Corporate Woods Parkway",
      "city": "Uniontown",
      "state": "OH",
      "zip": "44685",
      "construction": "Non-Combustible",
      "occupancy": "Warehouse",
      "year_built": 2011,
      "stories": 1,
      "square_feet": 128000,
      "sprinklered": true,
      "roof_type": "Metal",
      "sprinkler_type": null,
      "fire_alarm_type": null,
      "building_value": 10240000,
      "contents_value": 2560000,
      "bi_value": 5120000,
      "tiv": 17920000
    },
    {
      "location_number": "9",
      "address": "250 Civic Center Drive, Suite 600",
      "city": "Columbus",
      "state": "OH",
      "zip": "43215",
      "construction": "Fire Resistive",
      "occupancy": "Office",
      "year_built": 2006,
      "stories": 1,
      "square_feet": 8500,
      "sprinklered": true,
      "roof_type": "TPO",
      "sprinkler_type": null,
      "fire_alarm_type": null,
      "building_value": 0,
      "contents_value": 425000,
      "bi_value": 680000,
      "tiv": 1105000
    }
  ],
  "additional_coverages": [
    {
      "coverage_type": "Employee Dishonesty",
      "limit": 25000,
      "premium": null
    },
    {
      "coverage_type": "Blanket Additional Insured",
      "limit": null,
      "premium": null
    },
    {
      "coverage_type": "Data Compromise",
      "limit": 50000,
      "premium": null
    },
    {
      "coverage_type": "Damage to Premises Rented to You",
      "limit": 300000,
      "premium": null
    },
    {
      "coverage_type": "Valuable Papers",
      "limit": 25000,
      "premium": null
    },
    {
      "coverage_type": "Earthquake",
      "limit": 100000,
      "premium": null
    },
    {
      "coverage_type": "Professional Liability",
      "limit": 1000000,
      "premium": null
    },
    {
      "coverage_type": "Per Project General Aggregate",
      "limit": null,
      "premium": null
    },
    {
      "coverage_type": "Water Backup / Sump Overflow",
      "limit": 25000,
      "premium": null
    },
    {
      "coverage_type": "Debris Removal \u2014 Additional",
      "limit": 25000,
      "premium": null
    },
    {
      "coverage_type": "Computer Fraud",
      "limit": 25000,
      "premium": null
    },
    {
      "coverage_type": "Money & Securities \u2014 Inside",
      "limit": 10000,
      "premium": null
    },
    {
      "coverage_type": "Business Income \u2014 Civil Authority",
      "limit": 30,
      "premium": null
    }
  ],
  "interests": [
    {
      "name": "Bank of America, N.A.",
      "loan_number": "L-669740676",
      "interest_type": "ISAOA/ATIMA"
    },
    {
      "name": "Huntington National Bank",
      "loan_number": "L-618678792",
      "interest_type": "Loss Payee"
    },
    {
      "name": "U.S. Bank National Association",
      "loan_number": "L-146216755",
      "interest_type": "Loss Payee"
    }
  ],
  "property_premium": 424883.27,
  "property_deductible": 75000,
  "total_tiv": 251345000,
  "checkboxes": [
    {
      "field": "Does the applicant store flammable liquids on premises?",
      "value": "No"
    },
    {
      "field": "Does the applicant have a burglar alarm system?",
      "value": "No"
    },
    {
      "field": "Does the applicant sell or distribute products manufactured by others?",
      "value": "No"
    },
    {
      "field": "Is the building located within a flood zone?",
      "value": "No"
    },
    {
      "field": "Are there any alterations or construction in progress?",
      "value": "No"
    },
    {
      "field": "Is the applicant the building owner or tenant?",
      "value": "Yes"
    },
    {
      "field": "Is the building 100% sprinklered?",
      "value": "No"
    },
    {
      "field": "Are there any exterior signs or awnings?",
      "value": "No"
    },
    {
      "field": "Are commercial cooking operations (deep fat fryers, char broilers, woks, or commercial kitchen hoods) used on premises?",
      "value": "No"
    },
    {
      "field": "Is the applicant the sole occupant of the building?",
      "value": "Yes"
    },
    {
      "field": "Are there any underground storage tanks on premises?",
      "value": "No"
    },
    {
      "field": "Are there any swimming pools or hot tubs on premises?",
      "value": "No"
    }
  ],
  "remarks": null
}