{
  "additional_coverages": [
    {
      "coverage_type": "Extra Expense",
      "limit": 50000,
      "premium": null
    },
    {
      "coverage_type": "Valuable Papers",
      "limit": 25000,
      "premium": null
    },
    {
      "coverage_type": "Ordinance or Law \u2014 Coverage A",
      "limit": null,
      "premium": null
    },
    {
      "coverage_type": "Fire Department Service Charge",
      "limit": 2500,
      "premium": null
    },
    {
      "coverage_type": "Personal & Advertising Injury",
      "limit": 1000000,
      "premium": null
    },
    {
      "coverage_type": "Cyber Liability",
      "limit": 100000,
      "premium": null
    },
    {
      "coverage_type": "Electronic Data Processing",
      "limit": 50000,
      "premium": null
    },
    {
      "coverage_type": "Mechanical Breakdown",
      "limit": 100000,
      "premium": null
    },
    {
      "coverage_type": "Per Project General Aggregate",
      "limit": null,
      "premium": null
    },
    {
      "coverage_type": "Forgery or Alteration",
      "limit": 25000,
      "premium": null
    },
    {
      "coverage_type": "Waiver of Subrogation \u2014 Blanket",
      "limit": null,
      "premium": null
    }
  ],
  "applicant_info": {
    "entity_type": "Limited Partnership",
    "fein": "75-4829163",
    "naics_code": "531120",
    "nature_of_business": "Commercial real estate investment and property management \u2014 office, retail, and mixed-use properties across the Dallas-Fort Worth and Houston metropolitan areas",
    "sic_code": "6512",
    "years_in_business": 24
  },
  "checkboxes": [
    {
      "field": "Does the applicant sell or distribute products manufactured by others?",
      "value": "No"
    },
    {
      "field": "Are there any underground storage tanks on premises?",
      "value": "No"
    },
    {
      "field": "Does the applicant store flammable liquids on premises?",
      "value": "No"
    },
    {
      "field": "Are there any alterations or construction in progress?",
      "value": "No"
    },
    {
      "field": "Are there any tenant improvements or betterments?",
      "value": "No"
    },
    {
      "field": "Is the building located within a flood zone?",
      "value": "No"
    },
    {
      "field": "Is the applicant the sole occupant of the building?",
      "value": "No"
    },
    {
      "field": "Is the applicant the building owner or tenant?",
      "value": "Yes"
    },
    {
      "field": "Are there any cooking operations on premises?",
      "value": "No"
    },
    {
      "field": "Does the applicant have any off-premises property exposures?",
      "value": "No"
    },
    {
      "field": "Does the applicant have a burglar alarm system?",
      "value": "Yes"
    },
    {
      "field": "Are commercial cooking operations (deep fat fryers, char broilers, woks, or commercial kitchen hoods) used on premises?",
      "value": "No"
    },
    {
      "field": "Is the building 100% sprinklered?",
      "value": "Yes"
    },
    {
      "field": "Does the building have a backup generator?",
      "value": "No"
    }
  ],
  "form_info": {
    "form_edition": "2016/03",
    "form_number": "ACORD 160",
    "form_title": "BUSINESSOWNERS APPLICATION"
  },
  "header": {
    "carrier_name": "Apex Managing General Agency",
    "effective_date": "2025-07-01",
    "expiration_date": "2026-07-01",
    "insured_address": "2200 Ross Avenue, Suite 4500",
    "insured_city": "Dallas",
    "insured_name": "Lone Star Property Holdings, LP",
    "insured_state": "TX",
    "insured_zip": "75201",
    "policy_number": "CP-LSPH-2025-7801",
    "producer_code": "AG-225118",
    "producer_name": "Texas Commercial Insurance Partners"
  },
  "interests": [
    {
      "interest_type": "ISAOA/ATIMA",
      "loan_number": "L-848255659",
      "name": "Huntington National Bank"
    },
    {
      "interest_type": "As Their Interest May Appear",
      "loan_number": "L-620925734",
      "name": "M&T Bank"
    },
    {
      "interest_type": "First Mortgagee",
      "loan_number": "L-951058317",
      "name": "First National Bank"
    }
  ],
  "locations": [
    {
      "address": "8117 Preston Road",
      "bi_value": 15200000,
      "building_value": 62700000,
      "city": "Dallas",
      "construction": "Fire Resistive",
      "contents_value": 8550000,
      "fire_alarm_type": null,
      "location_number": "LOC-001",
      "occupancy": "Office",
      "roof_type": "Shingle",
      "sprinkler_type": null,
      "sprinklered": true,
      "square_feet": 285000,
      "state": "TX",
      "stories": 18,
      "tiv": 86450000,
      "year_built": 2008,
      "zip": "75225"
    },
    {
      "address": "5050 Westheimer Road",
      "bi_value": 8400000,
      "building_value": 33600000,
      "city": "Houston",
      "construction": "Fire Resistive",
      "contents_value": 5040000,
      "fire_alarm_type": null,
      "location_number": "LOC-002",
      "occupancy": "Office",
      "roof_type": "TPO",
      "sprinkler_type": null,
      "sprinklered": true,
      "square_feet": 168000,
      "state": "TX",
      "stories": 12,
      "tiv": 47040000,
      "year_built": 2001,
      "zip": "77056"
    },
    {
      "address": "5060 Westheimer Road",
      "bi_value": 7100000,
      "building_value": 28400000,
      "city": "Houston",
      "construction": "Fire Resistive",
      "contents_value": 4260000,
      "fire_alarm_type": null,
      "location_number": "LOC-003",
      "occupancy": "Office",
      "roof_type": "Single-Ply Membrane",
      "sprinkler_type": null,
      "sprinklered": true,
      "square_feet": 142000,
      "state": "TX",
      "stories": 10,
      "tiv": 39760000,
      "year_built": 2003,
      "zip": "77056"
    },
    {
      "address": "7301 Lone Star Drive",
      "bi_value": 5700000,
      "building_value": 19000000,
      "city": "Plano",
      "construction": "Masonry Non-Combustible",
      "contents_value": 2850000,
      "fire_alarm_type": null,
      "location_number": "LOC-004",
      "occupancy": "Mercantile",
      "roof_type": "Concrete",
      "sprinkler_type": null,
      "sprinklered": true,
      "square_feet": 95000,
      "state": "TX",
      "stories": 2,
      "tiv": 27550000,
      "year_built": 2012,
      "zip": "75024"
    },
    {
      "address": "3200 McKinney Avenue",
      "bi_value": 9300000,
      "building_value": 31000000,
      "city": "Dallas",
      "construction": "Fire Resistive",
      "contents_value": 4650000,
      "fire_alarm_type": null,
      "location_number": "LOC-005",
      "occupancy": "Mercantile",
      "roof_type": "TPO",
      "sprinkler_type": null,
      "sprinklered": true,
      "square_feet": 124000,
      "state": "TX",
      "stories": 6,
      "tiv": 44950000,
      "year_built": 2018,
      "zip": "75204"
    },
    {
      "address": "1400 Enclave Parkway",
      "bi_value": 5712000,
      "building_value": 19040000,
      "city": "Houston",
      "construction": "Non-Combustible",
      "contents_value": 2856000,
      "fire_alarm_type": null,
      "location_number": "LOC-006",
      "occupancy": "Office",
      "roof_type": "EPDM",
      "sprinkler_type": null,
      "sprinklered": true,
      "square_feet": 112000,
      "state": "TX",
      "stories": 8,
      "tiv": 27608000,
      "year_built": 1995,
      "zip": "77077"
    },
    {
      "address": "800 8th Avenue",
      "bi_value": 4680000,
      "building_value": 17160000,
      "city": "Fort Worth",
      "construction": "Fire Resistive",
      "contents_value": 3510000,
      "fire_alarm_type": null,
      "location_number": "LOC-007",
      "occupancy": "Office",
      "roof_type": "Shingle",
      "sprinkler_type": null,
      "sprinklered": true,
      "square_feet": 78000,
      "state": "TX",
      "stories": 5,
      "tiv": 25350000,
      "year_built": 2015,
      "zip": "76104"
    },
    {
      "address": "1256 Main Street",
      "bi_value": 3120000,
      "building_value": 11440000,
      "city": "Southlake",
      "construction": "Masonry Non-Combustible",
      "contents_value": 1716000,
      "fire_alarm_type": null,
      "location_number": "LOC-008",
      "occupancy": "Mercantile",
      "roof_type": "TPO",
      "sprinkler_type": null,
      "sprinklered": true,
      "square_feet": 52000,
      "state": "TX",
      "stories": 3,
      "tiv": 16276000,
      "year_built": 2006,
      "zip": "76092"
    }
  ],
  "property_deductible": 50000,
  "property_premium": 403697.14,
  "remarks": "Valuation: Replacement Cost. Billing plan: Direct Bill \u2014 Quarterly. NAIC code: 68074. Additional Coverages table shows placeholder text 'DEADBEEF_MISSING_DEDUCTIBLE' for several deductible fields.",
  "total_tiv": 314984000
}