{
  "additional_coverages": [
    {
      "coverage_type": "Funds Transfer Fraud",
      "limit": 25000,
      "premium": null
    },
    {
      "coverage_type": "Tenant Legal Liability",
      "limit": 100000,
      "premium": null
    },
    {
      "coverage_type": "Exterior Glass",
      "limit": 5000,
      "premium": null
    },
    {
      "coverage_type": "Electronic Data Processing",
      "limit": 50000,
      "premium": null
    },
    {
      "coverage_type": "Cyber Liability",
      "limit": 100000,
      "premium": null
    },
    {
      "coverage_type": "Computer Fraud",
      "limit": 25000,
      "premium": null
    },
    {
      "coverage_type": "Debris Removal - Additional",
      "limit": 25000,
      "premium": null
    },
    {
      "coverage_type": "Medical Expenses",
      "limit": 5000,
      "premium": null
    },
    {
      "coverage_type": "Money & Securities - Inside",
      "limit": 10000,
      "premium": null
    }
  ],
  "applicant_info": {
    "entity_type": "LLC",
    "fein": "74-6162022",
    "naics_code": "721110",
    "nature_of_business": "Boutique hotel ownership and management, with independent restaurant and event operations across Central and South Texas.",
    "sic_code": "7011",
    "years_in_business": 16
  },
  "checkboxes": [
    {
      "field": "Are there any cooking operations on premises?",
      "value": "No"
    },
    {
      "field": "Is the applicant responsible for building maintenance?",
      "value": "Yes"
    },
    {
      "field": "Does the applicant have any off-premises property exposure?",
      "value": "No"
    },
    {
      "field": "Does the applicant sell or distribute products manufactured by others?",
      "value": "No"
    },
    {
      "field": "Are there any underground storage tanks on premises?",
      "value": "No"
    },
    {
      "field": "Does the applicant store flammable liquids on premises?",
      "value": "No"
    },
    {
      "field": "Does the building have a backup generator?",
      "value": "No"
    },
    {
      "field": "Is the applicant the sole occupant of the building?",
      "value": "Yes"
    },
    {
      "field": "Is the applicant the building owner or tenant?",
      "value": "Yes"
    },
    {
      "field": "Is the building 100% sprinklered?",
      "value": "Yes"
    },
    {
      "field": "Are there any tenant improvements or betterments?",
      "value": "Yes"
    }
  ],
  "form_info": {
    "form_edition": "2016/03",
    "form_number": "ACORD 160",
    "form_title": "Businessowners Application"
  },
  "header": {
    "carrier_name": "Hallmark Insurance Group",
    "effective_date": "2026-05-01",
    "expiration_date": "2027-05-01",
    "insured_address": "401 Congress Avenue, Suite 2800",
    "insured_city": "Austin",
    "insured_name": "Hill Country Hospitality Partners, LLC",
    "insured_state": "TX",
    "insured_zip": "78701",
    "policy_number": "CP-HCHP-2025-3352",
    "producer_code": null,
    "producer_name": "Capitol Insurance Advisors"
  },
  "interests": [
    {
      "interest_type": "Mortgagee/ATIMA",
      "loan_number": "L-65098349",
      "name": "Capital Lending Corp"
    }
  ],
  "locations": [
    {
      "address": "604 Brazos Street",
      "bi_value": 10687500,
      "building_value": 30500000,
      "city": "Austin",
      "construction": "Fire Resistive",
      "contents_value": 7125000,
      "fire_alarm_type": null,
      "location_number": "LOC-001",
      "occupancy": "Hotel",
      "roof_type": "TPO",
      "sprinkler_type": null,
      "sprinklered": true,
      "square_feet": 95000,
      "state": "TX",
      "stories": 8,
      "tiv": 48312500,
      "year_built": 2010,
      "zip": "78701"
    },
    {
      "address": "112 College Street",
      "bi_value": 14910000,
      "building_value": 39760000,
      "city": "San Antonio",
      "construction": "Fire Resistive",
      "contents_value": 8940000,
      "fire_alarm_type": null,
      "location_number": "LOC-002",
      "occupancy": "Hotel",
      "roof_type": "Metal",
      "sprinkler_type": null,
      "sprinklered": true,
      "square_feet": 142000,
      "state": "TX",
      "stories": 12,
      "tiv": 63610000,
      "year_built": 2006,
      "zip": "78205"
    },
    {
      "address": "501 East Main Street",
      "bi_value": 3960000,
      "building_value": 10560000,
      "city": "Fredericksburg",
      "construction": "Masonry Non-Combustible",
      "contents_value": 2640000,
      "fire_alarm_type": null,
      "location_number": "LOC-003",
      "occupancy": "Hotel",
      "roof_type": "Built-Up",
      "sprinkler_type": null,
      "sprinklered": true,
      "square_feet": 48000,
      "state": "TX",
      "stories": 3,
      "tiv": 17160000,
      "year_built": 1996,
      "zip": "78624"
    },
    {
      "address": "1220 South Congress Avenue",
      "bi_value": 5812500,
      "building_value": 15500000,
      "city": "Austin",
      "construction": "Masonry Non-Combustible",
      "contents_value": 3875000,
      "fire_alarm_type": null,
      "location_number": "LOC-004",
      "occupancy": "Hotel",
      "roof_type": "Concrete",
      "sprinkler_type": null,
      "sprinklered": true,
      "square_feet": 62000,
      "state": "TX",
      "stories": 4,
      "tiv": 25187500,
      "year_built": 2015,
      "zip": "78704"
    },
    {
      "address": "808 Brazos Street",
      "bi_value": 1700000,
      "building_value": 2550000,
      "city": "Austin",
      "construction": "Fire Resistive",
      "contents_value": 850000,
      "fire_alarm_type": null,
      "location_number": "LOC-005",
      "occupancy": "Restaurant",
      "roof_type": "Metal",
      "sprinkler_type": null,
      "sprinklered": true,
      "square_feet": 8500,
      "state": "TX",
      "stories": 1,
      "tiv": 5100000,
      "year_built": 2010,
      "zip": "78701"
    },
    {
      "address": "5500 Comanche Trail",
      "bi_value": 1800000,
      "building_value": 1000000,
      "city": "Austin",
      "construction": "Non-Combustible",
      "contents_value": 900000,
      "fire_alarm_type": null,
      "location_number": "LOC-006",
      "occupancy": "Restaurant",
      "roof_type": "EPDM",
      "sprinkler_type": null,
      "sprinklered": true,
      "square_feet": 12000,
      "state": "TX",
      "stories": 2,
      "tiv": 3700000,
      "year_built": 2012,
      "zip": "78732"
    },
    {
      "address": "303 Pearl Parkway",
      "bi_value": 1020000,
      "building_value": 1700000,
      "city": "San Antonio",
      "construction": "Joisted Masonry",
      "contents_value": 510000,
      "fire_alarm_type": null,
      "location_number": "LOC-007",
      "occupancy": "Restaurant",
      "roof_type": "EPDM",
      "sprinkler_type": null,
      "sprinklered": true,
      "square_feet": 6800,
      "state": "TX",
      "stories": 1,
      "tiv": 3230000,
      "year_built": 2014,
      "zip": "78215"
    },
    {
      "address": "401 Congress Avenue, Suite 2800",
      "bi_value": 620000,
      "building_value": 0,
      "city": "Austin",
      "construction": "Fire Resistive",
      "contents_value": 1310000,
      "fire_alarm_type": null,
      "location_number": "LOC-008",
      "occupancy": "Office",
      "roof_type": "Shingle",
      "sprinkler_type": null,
      "sprinklered": true,
      "square_feet": 6200,
      "state": "TX",
      "stories": 1,
      "tiv": 1930000,
      "year_built": 2008,
      "zip": "78701"
    }
  ],
  "property_deductible": 10000,
  "property_premium": 265469.62,
  "remarks": "Billing plan: Direct Bill - Quarterly. Valuation: Replacement Cost. Property totals: Building 101570000; Business Personal Property 26150000; Business Income with Extra Expense 40510000. Liability limits: Each Occurrence 1000000; General Aggregate 2000000; Products/Completed Operations 2000000; Personal & Advertising Injury 500000; Damage to Premises Rented To You 300000; Medical Expense any one person 10000.",
  "total_tiv": 168230000
}